{
  "serving_type": "tf",
  "input_model": "model/resnet50.ckpt",
  "export_path":  "model_repos",
  "input_names": [
      "input_1:0"
  ],
  "output_names": [
      "fc1000/Softmax:0"
  ],
  "input_formats": [
      "channels_last"
  ],
  "input_signatures": [
      "image"
  ],
  "output_signatures": [
      "label"
  ],
  "model_name": "resnet50",
  "max_batch_size": 128
}